{
  "schema_version": "papers-coverage/v1",
  "prepared_on": "2026-10-22",
  "policy": "Near-exhaustive is a research objective. Coverage is measured only against explicit dated source/domain cohorts, never an assumed global universe.",
  "dimensions": [
    "Workstream",
    "Research Domain",
    "Publication Type",
    "Research Object",
    "Source Family",
    "Research Method",
    "Qualification and Failure State"
  ],
  "entries": [
    {
      "id": "PAPER-COV-001",
      "dimension": "Workstream",
      "subject": "Program Scope and Scientific Taxonomy",
      "work_packages": [
        "PAPER-01.01",
        "PAPER-01.02",
        "PAPER-01.03",
        "PAPER-01.04",
        "PAPER-01.05",
        "PAPER-01.06",
        "PAPER-01.07",
        "PAPER-01.08"
      ],
      "scope": "Define a bounded, auditable literature-index mission and its scientific classifications.",
      "state": "Planned",
      "denominator": {
        "unit": "independently reviewable work packages",
        "definition": "The explicitly enumerated planned work packages in this workstream at the current baseline revision.",
        "size": 8,
        "status": "Planning Scope Enumerated",
        "reason": "Known planning scope only; this count is not a measured literature population or completed research outcome."
      },
      "completion_evidence": "Reviewed coverage ledger with exact source/query revisions, counts and exclusions; no global-exhaustiveness claim."
    },
    {
      "id": "PAPER-COV-002",
      "dimension": "Workstream",
      "subject": "Scholarly Discovery and Source Integration",
      "work_packages": [
        "PAPER-02.01",
        "PAPER-02.02",
        "PAPER-02.03",
        "PAPER-02.04",
        "PAPER-02.05",
        "PAPER-02.06",
        "PAPER-02.07",
        "PAPER-02.08",
        "PAPER-02.09",
        "PAPER-02.10"
      ],
      "scope": "Qualify diverse literature discovery sources and their bounded acquisition interfaces.",
      "state": "Planned",
      "denominator": {
        "unit": "independently reviewable work packages",
        "definition": "The explicitly enumerated planned work packages in this workstream at the current baseline revision.",
        "size": 10,
        "status": "Planning Scope Enumerated",
        "reason": "Known planning scope only; this count is not a measured literature population or completed research outcome."
      },
      "completion_evidence": "Reviewed coverage ledger with exact source/query revisions, counts and exclusions; no global-exhaustiveness claim."
    },
    {
      "id": "PAPER-COV-003",
      "dimension": "Workstream",
      "subject": "Work Identity, Citations and Version Lineage",
      "work_packages": [
        "PAPER-03.01",
        "PAPER-03.02",
        "PAPER-03.03",
        "PAPER-03.04",
        "PAPER-03.05",
        "PAPER-03.06",
        "PAPER-03.07"
      ],
      "scope": "Resolve scholarly identity without losing conflicting provenance or revision history.",
      "state": "Planned",
      "denominator": {
        "unit": "independently reviewable work packages",
        "definition": "The explicitly enumerated planned work packages in this workstream at the current baseline revision.",
        "size": 7,
        "status": "Planning Scope Enumerated",
        "reason": "Known planning scope only; this count is not a measured literature population or completed research outcome."
      },
      "completion_evidence": "Reviewed coverage ledger with exact source/query revisions, counts and exclusions; no global-exhaustiveness claim."
    },
    {
      "id": "PAPER-COV-004",
      "dimension": "Workstream",
      "subject": "Authors, Research Organizations and Collaborations",
      "work_packages": [
        "PAPER-04.01",
        "PAPER-04.02",
        "PAPER-04.03",
        "PAPER-04.04",
        "PAPER-04.05",
        "PAPER-04.06",
        "PAPER-04.07"
      ],
      "scope": "Represent scholarly contributors and affiliations without inferring private identity.",
      "state": "Planned",
      "denominator": {
        "unit": "independently reviewable work packages",
        "definition": "The explicitly enumerated planned work packages in this workstream at the current baseline revision.",
        "size": 7,
        "status": "Planning Scope Enumerated",
        "reason": "Known planning scope only; this count is not a measured literature population or completed research outcome."
      },
      "completion_evidence": "Reviewed coverage ledger with exact source/query revisions, counts and exclusions; no global-exhaustiveness claim."
    },
    {
      "id": "PAPER-COV-005",
      "dimension": "Workstream",
      "subject": "AI Research Domains and Scientific Coverage",
      "work_packages": [
        "PAPER-05.01",
        "PAPER-05.02",
        "PAPER-05.03",
        "PAPER-05.04",
        "PAPER-05.05",
        "PAPER-05.06",
        "PAPER-05.07"
      ],
      "scope": "Maintain broad domain coverage without equating all AI research with current LLM work.",
      "state": "Planned",
      "denominator": {
        "unit": "independently reviewable work packages",
        "definition": "The explicitly enumerated planned work packages in this workstream at the current baseline revision.",
        "size": 7,
        "status": "Planning Scope Enumerated",
        "reason": "Known planning scope only; this count is not a measured literature population or completed research outcome."
      },
      "completion_evidence": "Reviewed coverage ledger with exact source/query revisions, counts and exclusions; no global-exhaustiveness claim."
    },
    {
      "id": "PAPER-COV-006",
      "dimension": "Workstream",
      "subject": "Methods, Architectures and Algorithm Lineage",
      "work_packages": [
        "PAPER-06.01",
        "PAPER-06.02",
        "PAPER-06.03",
        "PAPER-06.04",
        "PAPER-06.05",
        "PAPER-06.06",
        "PAPER-06.07"
      ],
      "scope": "Index scientific methods and their attributed development without duplicating model catalogs.",
      "state": "Planned",
      "denominator": {
        "unit": "independently reviewable work packages",
        "definition": "The explicitly enumerated planned work packages in this workstream at the current baseline revision.",
        "size": 7,
        "status": "Planning Scope Enumerated",
        "reason": "Known planning scope only; this count is not a measured literature population or completed research outcome."
      },
      "completion_evidence": "Reviewed coverage ledger with exact source/query revisions, counts and exclusions; no global-exhaustiveness claim."
    },
    {
      "id": "PAPER-COV-007",
      "dimension": "Workstream",
      "subject": "Research Object and Evidence Schemas",
      "work_packages": [
        "PAPER-07.01",
        "PAPER-07.02",
        "PAPER-07.03",
        "PAPER-07.04",
        "PAPER-07.05",
        "PAPER-07.06",
        "PAPER-07.07"
      ],
      "scope": "Establish versioned scholarly data contracts that preserve provenance and uncertainty.",
      "state": "Planned",
      "denominator": {
        "unit": "independently reviewable work packages",
        "definition": "The explicitly enumerated planned work packages in this workstream at the current baseline revision.",
        "size": 7,
        "status": "Planning Scope Enumerated",
        "reason": "Known planning scope only; this count is not a measured literature population or completed research outcome."
      },
      "completion_evidence": "Reviewed coverage ledger with exact source/query revisions, counts and exclusions; no global-exhaustiveness claim."
    },
    {
      "id": "PAPER-COV-008",
      "dimension": "Workstream",
      "subject": "Experimental Claims and Scientific Evidence",
      "work_packages": [
        "PAPER-08.01",
        "PAPER-08.02",
        "PAPER-08.03",
        "PAPER-08.04",
        "PAPER-08.05",
        "PAPER-08.06",
        "PAPER-08.07"
      ],
      "scope": "Capture reported findings faithfully and assess comparison conditions without inventing validation.",
      "state": "Planned",
      "denominator": {
        "unit": "independently reviewable work packages",
        "definition": "The explicitly enumerated planned work packages in this workstream at the current baseline revision.",
        "size": 7,
        "status": "Planning Scope Enumerated",
        "reason": "Known planning scope only; this count is not a measured literature population or completed research outcome."
      },
      "completion_evidence": "Reviewed coverage ledger with exact source/query revisions, counts and exclusions; no global-exhaustiveness claim."
    },
    {
      "id": "PAPER-COV-009",
      "dimension": "Workstream",
      "subject": "Datasets, Models, Code and Benchmark Linkages",
      "work_packages": [
        "PAPER-09.01",
        "PAPER-09.02",
        "PAPER-09.03",
        "PAPER-09.04",
        "PAPER-09.05",
        "PAPER-09.06",
        "PAPER-09.07"
      ],
      "scope": "Link papers to exact external research artifacts while preserving their technical owners.",
      "state": "Planned",
      "denominator": {
        "unit": "independently reviewable work packages",
        "definition": "The explicitly enumerated planned work packages in this workstream at the current baseline revision.",
        "size": 7,
        "status": "Planning Scope Enumerated",
        "reason": "Known planning scope only; this count is not a measured literature population or completed research outcome."
      },
      "completion_evidence": "Reviewed coverage ledger with exact source/query revisions, counts and exclusions; no global-exhaustiveness claim."
    },
    {
      "id": "PAPER-COV-010",
      "dimension": "Workstream",
      "subject": "Reproducibility and Independent Validation",
      "work_packages": [
        "PAPER-10.01",
        "PAPER-10.02",
        "PAPER-10.03",
        "PAPER-10.04",